{
  "schemaVersion": 3,
  "planId": "replace-me",
  "objective": "Replace with the bounded multi-step design objective.",
  "terminalTruth": "Name the exact changed artifact and proof required for completion.",
  "state": "ACTIVE",
  "obligations": [
    {
      "id": "req-first-packet",
      "sourceText": "Replace with one verbatim user obligation that this plan must satisfy.",
      "required": true,
      "proofRequired": true,
      "status": "ACTIVE",
      "evidenceRefs": [],
      "blocker": ""
    }
  ],
  "nodes": [
    {
      "id": "first-packet",
      "type": "VERTICAL_SLICE",
      "label": "First accountable packet",
      "outcome": "Describe the observable result.",
      "status": "ACTIVE",
      "obligationIds": ["req-first-packet"],
      "dependsOn": [],
      "entrypoint": "Bind the exact Figma target before mutation.",
      "proof": ["Name the real artifact/runtime evidence."],
      "evidenceRefs": [],
      "nonGoals": ["Do not broaden product behavior."],
      "recovery": "Inspect the target before retrying any timed-out mutation."
    }
  ],
  "edges": [],
  "frontier": ["first-packet"],
  "notesPath": "path/to/rolling-notes.md"
}
